{"allocation_rules_and_resources_reviewed":true,"approved_at":"2026-10-29T01:10:52.087708+00:00","approved_by":"Will Wallace","authorization":"RUN-3840-SHARED-NOISE-CALIBRATION-V1","authorization_id":"restart-f64a0c5bcd5f496b8189e4dbd13a871d","config_sha256":"79a275d06a8a1997981484f15d27cb5e76b39fd2a28b660a4251ddc35e83e756","environment_sha256":"6ef3b0cf006b693d9e8622044e7bd833299773c11b7276298a55caec713d2174","experiment_id":"week9-shared-noise-calibration-v1","fixture_only":false,"output_directory":"C:\\PUF+SNN_SharedRepo\\PUF-SNN\\results\\week-9\\will\\shared-noise-calibration-v1\\week9-shared-noise-calibration-v1-20261029t011009z-restart-9384a318","plan_sha256":"e5d4deaf8b944dd514fbdcf2bba31cd91ec5dc22e66478ca8a55701a594135ff","previous_failed_authorization_id":"task2h-20261029t003215z-d55070ef","resource_budgets":{"bundle_growth_bytes":536870912,"bundle_seconds":1800.0,"memory_bytes":4294967296,"min_free_disk_bytes":1073741824,"min_free_ram_bytes":8589934592,"sample_seconds":0.05,"session_seconds":1800.0,"stop_grace_seconds":2.0,"total_growth_bytes":1073741824},"restart_reason":"Previous calibration interrupted by monitor.json atomic replacement WinError 5. Week 9 monitoring remediation is committed and validated; this is a separately authorized restart of the unchanged complete calibration, with coordinated live status inspection.","rules_version":"week9-shared-noise-calibration-v1:proposed-rules-v1","run_id":"week9-shared-noise-calibration-v1-20261029t011009z-restart-9384a318","schema_version":"week9-shared-noise-calibration-v1:approval-v2","source_id":"a888acae484452b4a85c8442c6d5c3d7fa39b555d27b699bd4f0eaf37fbaf5f6","specification_sha256":"f5a12c19e9228860b901e9abb0eee4c16aa4dbaa785bbea32fa4b5e31b244b23"}
